{
  "$schema": "https://json-schema.org/draft/2020-12/schema",
  "$id": "https://hadr.example/contract.v1.schema.json",
  "title": "Contract",
  "type": "object",
  "additionalProperties": false,
  "required": ["schema_version", "generated_at", "meta", "events"],
  "properties": {
    "schema_version": { "const": "1.0.0" },
    "generated_at": { "type": "string", "format": "date-time" },
    "meta": {
      "type": "object",
      "additionalProperties": false,
      "required": ["feeds"],
      "properties": {
        "feeds": { "type": "array", "items": { "$ref": "#/$defs/FeedHealth" } }
      }
    },
    "events": { "type": "array", "items": { "$ref": "#/$defs/CrisisEvent" } }
  },
  "$defs": {
    "FeedHealth": {
      "title": "FeedHealth",
      "type": "object",
      "additionalProperties": false,
      "required": ["source", "window", "status", "fetched_at", "event_count"],
      "properties": {
        "source": { "type": "string", "enum": ["usgs"] },
        "window": { "type": "string", "enum": ["all_day", "significant_week"] },
        "status": { "type": "string", "enum": ["ok", "error"] },
        "fetched_at": { "type": "string", "format": "date-time" },
        "event_count": { "type": "integer", "minimum": 0 },
        "error": { "type": "string" }
      }
    },
    "Geometry": {
      "title": "Geometry",
      "type": "object",
      "additionalProperties": false,
      "required": ["lat", "lon"],
      "properties": {
        "lat": { "type": "number", "minimum": -90, "maximum": 90 },
        "lon": { "type": "number", "minimum": -180, "maximum": 180 },
        "depth_km": { "type": ["number", "null"] }
      }
    },
    "Severity": {
      "title": "Severity",
      "type": "object",
      "additionalProperties": false,
      "required": ["level", "inputs"],
      "properties": {
        "level": { "type": "string", "enum": ["minor", "moderate", "serious", "severe"] },
        "inputs": {
          "type": "object",
          "additionalProperties": false,
          "required": ["mag", "sig", "alert"],
          "properties": {
            "mag": { "type": "number" },
            "sig": { "type": ["integer", "null"] },
            "alert": { "type": ["string", "null"], "enum": ["green", "yellow", "orange", "red", null] }
          }
        }
      }
    },
    "FeedSource": {
      "title": "FeedSource",
      "type": "object",
      "additionalProperties": false,
      "required": ["feed", "id", "url"],
      "properties": {
        "feed": { "type": "string", "enum": ["usgs"] },
        "id": { "type": "string" },
        "url": { "type": "string", "format": "uri" }
      }
    },
    "CrisisEvent": {
      "title": "CrisisEvent",
      "type": "object",
      "additionalProperties": false,
      "required": ["id", "hazard", "title", "place", "time", "geometry", "magnitude", "severity", "major", "provisional", "sources"],
      "properties": {
        "id": { "type": "string", "pattern": "^[a-z]+:.+" },
        "hazard": { "type": "string", "enum": ["EQ"] },
        "title": { "type": "string" },
        "place": { "type": "string" },
        "time": { "type": "string", "format": "date-time" },
        "geometry": { "$ref": "#/$defs/Geometry" },
        "magnitude": { "type": "number" },
        "severity": { "$ref": "#/$defs/Severity" },
        "major": { "type": "boolean" },
        "provisional": { "type": "boolean" },
        "sources": { "type": "array", "minItems": 1, "items": { "$ref": "#/$defs/FeedSource" } }
      }
    }
  }
}
