{
  "schema_version": "1.0.0",
  "generated_at": "2026-07-08T12:00:00Z",
  "meta": {
    "feeds": [
      { "source": "usgs", "window": "all_day", "status": "ok", "fetched_at": "2026-07-08T12:00:00Z", "event_count": 3 },
      { "source": "usgs", "window": "significant_week", "status": "ok", "fetched_at": "2026-07-08T12:00:00Z", "event_count": 1 }
    ]
  },
  "events": [
    {
      "id": "usgs:us6000severe",
      "hazard": "EQ",
      "title": "M 7.1 - 40 km W of Testville",
      "place": "40 km W of Testville",
      "time": "2026-07-08T09:00:00Z",
      "geometry": { "lat": -19.1, "lon": -70.9, "depth_km": 34.2 },
      "magnitude": 7.1,
      "severity": { "level": "severe", "inputs": { "mag": 7.1, "sig": 1200, "alert": "red" } },
      "major": true,
      "provisional": true,
      "sources": [ { "feed": "usgs", "id": "us6000severe", "url": "https://earthquake.usgs.gov/earthquakes/eventpage/us6000severe" } ]
    },
    {
      "id": "usgs:us6000serious",
      "hazard": "EQ",
      "title": "M 6.0 - 12 km S of Sampletown",
      "place": "12 km S of Sampletown",
      "time": "2026-07-08T06:30:00Z",
      "geometry": { "lat": 35.7, "lon": 139.7, "depth_km": 10.0 },
      "magnitude": 6.0,
      "severity": { "level": "serious", "inputs": { "mag": 6.0, "sig": 640, "alert": null } },
      "major": true,
      "provisional": false,
      "sources": [ { "feed": "usgs", "id": "us6000serious", "url": "https://earthquake.usgs.gov/earthquakes/eventpage/us6000serious" } ]
    },
    {
      "id": "usgs:us6000minor",
      "hazard": "EQ",
      "title": "M 3.2 - 5 km NE of Quietville",
      "place": "5 km NE of Quietville",
      "time": "2026-07-08T11:00:00Z",
      "geometry": { "lat": 34.0, "lon": -118.2, "depth_km": 8.0 },
      "magnitude": 3.2,
      "severity": { "level": "minor", "inputs": { "mag": 3.2, "sig": 158, "alert": null } },
      "major": false,
      "provisional": false,
      "sources": [ { "feed": "usgs", "id": "us6000minor", "url": "https://earthquake.usgs.gov/earthquakes/eventpage/us6000minor" } ]
    }
  ]
}
